{
    "metadata": {
        "freshness_policy_registry_id": "MOXDOP_DATA_FRESHNESS_POLICY",
        "version": 1,
        "title": "MoxDOP Data Freshness Policy Registry V1",
        "description": "Dataset-specific freshness, maturity, reprocessing and incremental collection policy. Does not redefine provider fields or formulas. No global last-sync or global lookback.",
        "verification_date": "2026-08-13",
        "numeric_freshness_score": false,
        "global_last_sync_forbidden": true,
        "global_reprocess_window_forbidden": true
    },
    "enums": {
        "collection_mode": [
            "HISTORICAL_INCREMENTAL",
            "CURRENT_SNAPSHOT",
            "PERIOD_OBSERVATION",
            "CONTROLLED_ON_DEMAND",
            "STATIC_OR_SLOW_METADATA"
        ],
        "freshness_state": [
            "FRESH",
            "DUE",
            "STALE",
            "PARTIAL",
            "ACTION_REQUIRED",
            "PROVIDER_LIMITED",
            "INTEGRITY_BLOCKED",
            "UNKNOWN",
            "FRESH_WITH_LIMITATION"
        ],
        "incremental_work_reason": [
            "NEW_COVERAGE",
            "CATCH_UP",
            "LATE_DATA_REPROCESS",
            "GAP_RECOVERY",
            "SNAPSHOT_REFRESH",
            "CONTRACT_UPGRADE",
            "MANUAL_REPLAY"
        ]
    },
    "global_policies": {
        "no_single_global_last_sync": true,
        "watermark_per_resource_dataset": true,
        "freshness_per_resource_dataset": true,
        "max_fact_date_is_not_verified_watermark": true,
        "zero_row_success_advances_coverage": true,
        "failed_collection_does_not_advance_verified_watermark": true,
        "current_open_day_not_automatically_complete": true,
        "reprocessing_may_overlap_existing_coverage": true,
        "catch_up_derived_from_coverage_not_scheduler_history": true,
        "no_recurring_scheduler_in_this_registry": true,
        "planner_must_not_build_provider_request_syntax": true
    },
    "dataset_policies": [
        {
            "dataset_id": "ga4_property_metadata",
            "provider_or_source": "GA4",
            "policy_version": 1,
            "collection_mode": "CURRENT_SNAPSHOT",
            "incremental_applicable": true,
            "non_applicable_reason": null,
            "reporting_grain": [
                "property_id"
            ],
            "timezone_source": "ga4_property_timezone",
            "current_period_collectable": false,
            "safe_collection_lag_days": null,
            "freshness_sla_hours": 168,
            "expected_refresh_cadence": "daily",
            "late_data_reprocessing": {
                "strategy": "replace_current_snapshot",
                "window_days": null,
                "window_source": "not_applicable",
                "overlap_existing_coverage_allowed": false
            },
            "catch_up_policy": "snapshot_refresh_if_stale",
            "max_bounded_incremental_span_days": null,
            "snapshot_policy": {
                "freshness_basis": "last_successful_collection_at",
                "freshness_sla_hours": 168,
                "historical_watermark_applicable": false,
                "reprocessing_applicable": false
            },
            "provider_history_limitation_ref": null,
            "integrity_dependency": {
                "integrity_registry_id": "MOXDOP_DATA_INTEGRITY_REGISTRY",
                "blocks_trusted_fresh_on_migration_blocking_fail": true
            },
            "contract_refresh_policy": {
                "type": "on_demand_or_daily",
                "cadence": "daily"
            },
            "contract_history_policy": {
                "minimum_required": "current",
                "recommended_initial_backfill": "current",
                "decision_required": false
            },
            "period_non_additive_notes": null,
            "policy_source": {
                "data_contract_dataset_id": "ga4_property_metadata",
                "integrity_profile": true,
                "provider_documentation_verified_at": "2026-08-13",
                "provider_documentation": {
                    "sources": [
                        "https://support.google.com/analytics/answer/11198161",
                        "https://support.google.com/analytics/answer/12233314"
                    ],
                    "notes": "Official docs: daily processing commonly 24-48h; reports may change after daily availability; some data can arrive late (up to ~7 days). Not a hard SLA — conservative safe lag 2 days; reprocess window 7 days."
                }
            }
        },
        {
            "dataset_id": "ga4_property_daily",
            "provider_or_source": "GA4",
            "policy_version": 1,
            "collection_mode": "HISTORICAL_INCREMENTAL",
            "incremental_applicable": true,
            "non_applicable_reason": null,
            "reporting_grain": [
                "property_id",
                "date"
            ],
            "timezone_source": "ga4_property_timezone",
            "current_period_collectable": false,
            "safe_collection_lag_days": 2,
            "freshness_sla_hours": 48,
            "expected_refresh_cadence": "daily",
            "late_data_reprocessing": {
                "strategy": "fixed_recent_reporting_window",
                "window_days": 7,
                "window_source": "MOXDOP_DATA_FRESHNESS_POLICY_V1 + provider_docs_verified_2026-08-13 + contract.refresh_policy.late_data_recheck=provider_dependent",
                "overlap_existing_coverage_allowed": true
            },
            "catch_up_policy": "coverage_gap_to_collectable_end",
            "max_bounded_incremental_span_days": 31,
            "snapshot_policy": null,
            "provider_history_limitation_ref": null,
            "integrity_dependency": {
                "integrity_registry_id": "MOXDOP_DATA_INTEGRITY_REGISTRY",
                "blocks_trusted_fresh_on_migration_blocking_fail": true
            },
            "contract_refresh_policy": {
                "type": "incremental",
                "cadence": "daily",
                "late_data_recheck": "provider_dependent"
            },
            "contract_history_policy": {
                "minimum_required": "provider_16m_available",
                "recommended_initial_backfill": "provider_16m_available",
                "decision_required": false
            },
            "period_non_additive_notes": null,
            "policy_source": {
                "data_contract_dataset_id": "ga4_property_daily",
                "integrity_profile": true,
                "provider_documentation_verified_at": "2026-08-13",
                "provider_documentation": {
                    "sources": [
                        "https://support.google.com/analytics/answer/11198161",
                        "https://support.google.com/analytics/answer/12233314"
                    ],
                    "notes": "Official docs: daily processing commonly 24-48h; reports may change after daily availability; some data can arrive late (up to ~7 days). Not a hard SLA — conservative safe lag 2 days; reprocess window 7 days."
                }
            }
        },
        {
            "dataset_id": "ga4_acquisition_channel_daily",
            "provider_or_source": "GA4",
            "policy_version": 1,
            "collection_mode": "HISTORICAL_INCREMENTAL",
            "incremental_applicable": true,
            "non_applicable_reason": null,
            "reporting_grain": [
                "property_id",
                "date",
                "sessionDefaultChannelGroup"
            ],
            "timezone_source": "ga4_property_timezone",
            "current_period_collectable": false,
            "safe_collection_lag_days": 2,
            "freshness_sla_hours": 48,
            "expected_refresh_cadence": "daily",
            "late_data_reprocessing": {
                "strategy": "fixed_recent_reporting_window",
                "window_days": 7,
                "window_source": "MOXDOP_DATA_FRESHNESS_POLICY_V1 + provider_docs_verified_2026-08-13 + contract.refresh_policy.late_data_recheck=provider_dependent",
                "overlap_existing_coverage_allowed": true
            },
            "catch_up_policy": "coverage_gap_to_collectable_end",
            "max_bounded_incremental_span_days": 31,
            "snapshot_policy": null,
            "provider_history_limitation_ref": null,
            "integrity_dependency": {
                "integrity_registry_id": "MOXDOP_DATA_INTEGRITY_REGISTRY",
                "blocks_trusted_fresh_on_migration_blocking_fail": true
            },
            "contract_refresh_policy": {
                "type": "incremental",
                "cadence": "daily",
                "late_data_recheck": "provider_dependent"
            },
            "contract_history_policy": {
                "minimum_required": "provider_16m_available",
                "recommended_initial_backfill": "provider_16m_available",
                "decision_required": false
            },
            "period_non_additive_notes": null,
            "policy_source": {
                "data_contract_dataset_id": "ga4_acquisition_channel_daily",
                "integrity_profile": true,
                "provider_documentation_verified_at": "2026-08-13",
                "provider_documentation": {
                    "sources": [
                        "https://support.google.com/analytics/answer/11198161",
                        "https://support.google.com/analytics/answer/12233314"
                    ],
                    "notes": "Official docs: daily processing commonly 24-48h; reports may change after daily availability; some data can arrive late (up to ~7 days). Not a hard SLA — conservative safe lag 2 days; reprocess window 7 days."
                }
            }
        },
        {